[2026-02-02 04:28:42] [INFO] === 启动中文教师职位爬虫 ===
[2026-02-02 04:28:42] [INFO] 初始化爬虫...
[2026-02-02 04:28:42] [INFO] 爬虫初始化完成，今天的日期是: 2026-02-02
[2026-02-02 04:28:42] [INFO] 开始抓取职位...
[2026-02-02 04:28:42] [INFO] 创建示例职位数据以确保输出...
[2026-02-02 04:28:42] [INFO] 正在抓取 Indeed 职位...
[2026-02-02 04:28:42] [INFO] 发起请求: https://www.indeed.com/jobs?q=chinese+teacher+$3000&sort=date&fromage=7&start=0
[2026-02-02 04:28:42] [WARNING] 请求被阻止 (状态码 403), 正在重试...
[2026-02-02 04:28:52] [INFO] 重试尝试 2, 等待 13.36 秒...
[2026-02-02 04:29:06] [WARNING] 请求被阻止 (状态码 403), 正在重试...
[2026-02-02 04:29:17] [INFO] 重试尝试 3, 等待 15.56 秒...
[2026-02-02 04:29:33] [WARNING] 请求被阻止 (状态码 403), 正在重试...
[2026-02-02 04:29:45] [ERROR] 尝试 3 次后无法检索 https://www.indeed.com/jobs?q=chinese+teacher+$3000&sort=date&fromage=7&start=0
[2026-02-02 04:29:45] [WARNING] 无法获取Indeed页面 0
[2026-02-02 04:29:45] [INFO] 发起请求: https://www.indeed.com/jobs?q=chinese+teacher+$3000&sort=date&fromage=7&start=10
[2026-02-02 04:29:45] [WARNING] 请求被阻止 (状态码 403), 正在重试...
[2026-02-02 04:30:00] [INFO] 重试尝试 2, 等待 7.04 秒...
[2026-02-02 04:30:07] [WARNING] 请求被阻止 (状态码 403), 正在重试...
[2026-02-02 04:30:19] [INFO] 重试尝试 3, 等待 14.96 秒...
[2026-02-02 04:30:34] [WARNING] 请求被阻止 (状态码 403), 正在重试...
[2026-02-02 04:30:48] [ERROR] 尝试 3 次后无法检索 https://www.indeed.com/jobs?q=chinese+teacher+$3000&sort=date&fromage=7&start=10
[2026-02-02 04:30:48] [WARNING] 无法获取Indeed页面 1
[2026-02-02 04:30:48] [INFO] 发起请求: https://www.indeed.com/jobs?q=chinese+teacher+$3000&sort=date&fromage=7&start=20
[2026-02-02 04:30:48] [WARNING] 请求被阻止 (状态码 403), 正在重试...
[2026-02-02 04:31:01] [INFO] 重试尝试 2, 等待 10.80 秒...
[2026-02-02 04:31:11] [WARNING] 请求被阻止 (状态码 403), 正在重试...
[2026-02-02 04:31:26] [INFO] 重试尝试 3, 等待 21.02 秒...
[2026-02-02 04:31:47] [WARNING] 请求被阻止 (状态码 403), 正在重试...
[2026-02-02 04:32:00] [ERROR] 尝试 3 次后无法检索 https://www.indeed.com/jobs?q=chinese+teacher+$3000&sort=date&fromage=7&start=20
[2026-02-02 04:32:00] [WARNING] 无法获取Indeed页面 2
[2026-02-02 04:32:00] [INFO] 从Indeed抓取了 0 个职位
[2026-02-02 04:32:06] [INFO] 正在抓取 LinkedIn 职位...
[2026-02-02 04:32:06] [INFO] 发起请求: https://www.linkedin.com/jobs/search/?keywords=chinese%20teacher&f_TPR=r604800
[2026-02-02 04:32:07] [INFO] 请求成功: https://www.linkedin.com/jobs/search/?keywords=chinese%20teacher&f_TPR=r604800
[2026-02-02 04:32:07] [INFO] 在LinkedIn上找到 60 个职位卡片
[2026-02-02 04:32:07] [INFO] 找到LinkedIn职位: High School: Mandarin Teacher (Delphi area) at Kreyco
[2026-02-02 04:32:07] [INFO] 找到LinkedIn职位: High School: Mandarin Teacher (Delphi area) at Kreyco
[2026-02-02 04:32:07] [INFO] 找到LinkedIn职位: High School: Mandarin Teacher (Delphi area) at Kreyco
[2026-02-02 04:32:07] [INFO] 找到LinkedIn职位: High School: Mandarin Teacher (Delphi area) at Kreyco
[2026-02-02 04:32:07] [INFO] 找到LinkedIn职位: High School: Mandarin Teacher (Delphi area) at Kreyco
[2026-02-02 04:32:07] [INFO] 找到LinkedIn职位: High School: Mandarin Teacher (Delphi area) at Kreyco
[2026-02-02 04:32:07] [INFO] 找到LinkedIn职位: Middle School Mandarin Chinese Teacher Part-Time Leave Replacement for the 2026-2027 School Year at Menlo School
[2026-02-02 04:32:07] [INFO] 找到LinkedIn职位: Mandarin Teacher - Middle and High School at Spring Education Group
[2026-02-02 04:32:07] [INFO] 找到LinkedIn职位: Upper School Mandarin Teacher at Head-Royce School
[2026-02-02 04:32:07] [INFO] 找到LinkedIn职位: Upper School Mandarin Teacher at Hillbrook School
[2026-02-02 04:32:07] [INFO] 找到LinkedIn职位: High School: Mandarin Teacher (Delphi area) at Kreyco
[2026-02-02 04:32:07] [INFO] 找到LinkedIn职位: High School: Mandarin Teacher (Delphi area) at Kreyco
[2026-02-02 04:32:07] [INFO] 找到LinkedIn职位: Mandarin Substitute Teacher at Spring Education Group
[2026-02-02 04:32:07] [INFO] 找到LinkedIn职位: Assistant Chinese Preschool Teacher at Purple Magpie Mandarin
[2026-02-02 04:32:07] [INFO] 找到LinkedIn职位: Mandarin Teacher for After-school at Manhattan Youth
[2026-02-02 04:32:07] [INFO] 从LinkedIn抓取了 15 个职位
[2026-02-02 04:32:14] [INFO] 正在抓取 Glassdoor 职位...
[2026-02-02 04:32:14] [INFO] 发起请求: https://www.glassdoor.com/Job/chinese-teacher-jobs-SRCH_KO0,15.htm
[2026-02-02 04:32:14] [WARNING] 请求被阻止 (状态码 403), 正在重试...
[2026-02-02 04:32:27] [INFO] 重试尝试 2, 等待 14.51 秒...
[2026-02-02 04:32:42] [WARNING] 请求被阻止 (状态码 403), 正在重试...
[2026-02-02 04:32:57] [INFO] 重试尝试 3, 等待 11.40 秒...
[2026-02-02 04:33:08] [WARNING] 请求被阻止 (状态码 403), 正在重试...
[2026-02-02 04:33:20] [ERROR] 尝试 3 次后无法检索 https://www.glassdoor.com/Job/chinese-teacher-jobs-SRCH_KO0,15.htm
[2026-02-02 04:33:20] [WARNING] 无法获取Glassdoor职位
[2026-02-02 04:33:20] [INFO] 从Glassdoor抓取了 0 个职位
[2026-02-02 04:33:29] [INFO] 正在抓取 Monster 职位...
[2026-02-02 04:33:29] [INFO] 发起请求: https://www.monster.com/jobs/search?q=Chinese+Teacher&saltyp=1&salary=3000&where=&page=1&so=date.desc
[2026-02-02 04:33:29] [INFO] 请求成功: https://www.monster.com/jobs/search?q=Chinese+Teacher&saltyp=1&salary=3000&where=&page=1&so=date.desc
[2026-02-02 04:33:29] [WARNING] 在Monster上找不到职位卡片，尝试替代选择器
[2026-02-02 04:33:29] [WARNING] 在Monster上使用任何选择器都找不到职位卡片
[2026-02-02 04:33:29] [INFO] 从Monster抓取了 0 个职位
[2026-02-02 04:33:37] [INFO] 正在抓取 SimplyHired 职位...
[2026-02-02 04:33:37] [INFO] 发起请求: https://www.simplyhired.com/search?q=chinese+teacher&fdb=7
[2026-02-02 04:33:37] [WARNING] 请求被阻止 (状态码 403), 正在重试...
[2026-02-02 04:33:48] [INFO] 重试尝试 2, 等待 12.20 秒...
[2026-02-02 04:34:01] [WARNING] 请求被阻止 (状态码 403), 正在重试...
[2026-02-02 04:34:11] [INFO] 重试尝试 3, 等待 13.28 秒...
[2026-02-02 04:34:24] [WARNING] 请求被阻止 (状态码 403), 正在重试...
[2026-02-02 04:34:38] [ERROR] 尝试 3 次后无法检索 https://www.simplyhired.com/search?q=chinese+teacher&fdb=7
[2026-02-02 04:34:38] [WARNING] 无法获取SimplyHired职位
[2026-02-02 04:34:38] [INFO] 从SimplyHired抓取了 0 个职位
[2026-02-02 04:34:38] [INFO] 找到真实数据，移除示例数据
[2026-02-02 04:34:38] [INFO] 职位抓取完成 (5/5 爬虫成功)
[2026-02-02 04:34:38] [INFO] 共找到 15 个符合条件的职位
[2026-02-02 04:34:38] [INFO] 保存结果到文件...
[2026-02-02 04:34:38] [INFO] 结果保存到 data/chinese_teacher_jobs_2026-02-02.csv
[2026-02-02 04:34:38] [INFO] 结果保存到 data/chinese_teacher_jobs_2026-02-02.json
[2026-02-02 04:34:38] [INFO] 摘要保存到 data/summary_2026-02-02.md
[2026-02-02 04:34:38] [INFO] 更新README文件...
[2026-02-02 04:34:38] [INFO] README.md已更新
[2026-02-02 04:34:38] [INFO] 职位抓取成功完成
[2026-02-02 04:34:38] [INFO] 找到 15 个符合条件的职位
[2026-02-02 04:34:38] [INFO] - 已保存到: data/chinese_teacher_jobs_2026-02-02.csv
[2026-02-02 04:34:38] [INFO] - 已保存到: data/chinese_teacher_jobs_2026-02-02.json
[2026-02-02 04:34:38] [INFO] - 已保存到: data/summary_2026-02-02.md
[2026-02-02 04:34:38] [INFO] === 中文教师职位爬虫完成 ===
