[2026-01-22 03:51:54] [INFO] === 启动中文教师职位爬虫 ===
[2026-01-22 03:51:54] [INFO] 初始化爬虫...
[2026-01-22 03:51:54] [INFO] 爬虫初始化完成，今天的日期是: 2026-01-22
[2026-01-22 03:51:54] [INFO] 开始抓取职位...
[2026-01-22 03:51:54] [INFO] 创建示例职位数据以确保输出...
[2026-01-22 03:51:54] [INFO] 正在抓取 Indeed 职位...
[2026-01-22 03:51:54] [INFO] 发起请求: https://www.indeed.com/jobs?q=chinese+teacher+$3000&sort=date&fromage=7&start=0
[2026-01-22 03:51:54] [WARNING] 请求被阻止 (状态码 403), 正在重试...
[2026-01-22 03:52:07] [INFO] 重试尝试 2, 等待 6.92 秒...
[2026-01-22 03:52:14] [WARNING] 请求被阻止 (状态码 403), 正在重试...
[2026-01-22 03:52:29] [INFO] 重试尝试 3, 等待 10.40 秒...
[2026-01-22 03:52:40] [WARNING] 请求被阻止 (状态码 403), 正在重试...
[2026-01-22 03:52:52] [ERROR] 尝试 3 次后无法检索 https://www.indeed.com/jobs?q=chinese+teacher+$3000&sort=date&fromage=7&start=0
[2026-01-22 03:52:52] [WARNING] 无法获取Indeed页面 0
[2026-01-22 03:52:52] [INFO] 发起请求: https://www.indeed.com/jobs?q=chinese+teacher+$3000&sort=date&fromage=7&start=10
[2026-01-22 03:52:52] [WARNING] 请求被阻止 (状态码 403), 正在重试...
[2026-01-22 03:53:04] [INFO] 重试尝试 2, 等待 13.32 秒...
[2026-01-22 03:53:18] [WARNING] 请求被阻止 (状态码 403), 正在重试...
[2026-01-22 03:53:32] [INFO] 重试尝试 3, 等待 21.06 秒...
[2026-01-22 03:53:53] [WARNING] 请求被阻止 (状态码 403), 正在重试...
[2026-01-22 03:54:06] [ERROR] 尝试 3 次后无法检索 https://www.indeed.com/jobs?q=chinese+teacher+$3000&sort=date&fromage=7&start=10
[2026-01-22 03:54:06] [WARNING] 无法获取Indeed页面 1
[2026-01-22 03:54:06] [INFO] 发起请求: https://www.indeed.com/jobs?q=chinese+teacher+$3000&sort=date&fromage=7&start=20
[2026-01-22 03:54:06] [WARNING] 请求被阻止 (状态码 403), 正在重试...
[2026-01-22 03:54:20] [INFO] 重试尝试 2, 等待 15.93 秒...
[2026-01-22 03:54:36] [WARNING] 请求被阻止 (状态码 403), 正在重试...
[2026-01-22 03:54:51] [INFO] 重试尝试 3, 等待 16.35 秒...
[2026-01-22 03:55:07] [WARNING] 请求被阻止 (状态码 403), 正在重试...
[2026-01-22 03:55:21] [ERROR] 尝试 3 次后无法检索 https://www.indeed.com/jobs?q=chinese+teacher+$3000&sort=date&fromage=7&start=20
[2026-01-22 03:55:21] [WARNING] 无法获取Indeed页面 2
[2026-01-22 03:55:21] [INFO] 从Indeed抓取了 0 个职位
[2026-01-22 03:55:29] [INFO] 正在抓取 LinkedIn 职位...
[2026-01-22 03:55:29] [INFO] 发起请求: https://www.linkedin.com/jobs/search/?keywords=chinese%20teacher&f_TPR=r604800
[2026-01-22 03:55:30] [INFO] 请求成功: https://www.linkedin.com/jobs/search/?keywords=chinese%20teacher&f_TPR=r604800
[2026-01-22 03:55:30] [INFO] 在LinkedIn上找到 60 个职位卡片
[2026-01-22 03:55:30] [INFO] 找到LinkedIn职位: Bilingual Simplified Chinese Teacher | $30/hr Remote at Crossing Hurdles
[2026-01-22 03:55:30] [INFO] 找到LinkedIn职位: Bilingual Traditional Chinese Teacher | $30/hr Remote at Crossing Hurdles
[2026-01-22 03:55:30] [INFO] 找到LinkedIn职位: ID: 1093468 | Chinese  Language teacher Needed in Fort Collins at Language Trainers
[2026-01-22 03:55:30] [INFO] 找到LinkedIn职位: Chinese Language Teacher needed - ID1092086 at Language Trainers
[2026-01-22 03:55:30] [INFO] 找到LinkedIn职位: Mandarin Chinese Teacher at International Leadership of Texas
[2026-01-22 03:55:30] [INFO] 找到LinkedIn职位: Chinese Elementary School Homeroom Teacher (PYP) at Silicon Valley International School
[2026-01-22 03:55:30] [INFO] 找到LinkedIn职位: High School: Mandarin Teacher (Allentown area and online) at Kreyco
[2026-01-22 03:55:30] [INFO] 找到LinkedIn职位: Adjunct Chinese Foreign Language Instructor at Inside Higher Ed
[2026-01-22 03:55:30] [INFO] 找到LinkedIn职位: Upper School Mandarin Teacher at Hillbrook School
[2026-01-22 03:55:30] [INFO] 找到LinkedIn职位: 3rd Grade- Chinese Teacher at Wake County Public School System
[2026-01-22 03:55:30] [INFO] 找到LinkedIn职位: 2026-2027 SK-5 Mandarin Teacher at Francis Parker School
[2026-01-22 03:55:30] [INFO] 找到LinkedIn职位: Assistant Chinese Preschool Teacher at Purple Magpie Mandarin
[2026-01-22 03:55:30] [INFO] 从LinkedIn抓取了 12 个职位
[2026-01-22 03:55:36] [INFO] 正在抓取 Glassdoor 职位...
[2026-01-22 03:55:36] [INFO] 发起请求: https://www.glassdoor.com/Job/chinese-teacher-jobs-SRCH_KO0,15.htm
[2026-01-22 03:55:36] [WARNING] 请求被阻止 (状态码 403), 正在重试...
[2026-01-22 03:55:47] [INFO] 重试尝试 2, 等待 9.83 秒...
[2026-01-22 03:55:57] [WARNING] 请求被阻止 (状态码 403), 正在重试...
[2026-01-22 03:56:11] [INFO] 重试尝试 3, 等待 23.08 秒...
[2026-01-22 03:56:34] [WARNING] 请求被阻止 (状态码 403), 正在重试...
[2026-01-22 03:56:48] [ERROR] 尝试 3 次后无法检索 https://www.glassdoor.com/Job/chinese-teacher-jobs-SRCH_KO0,15.htm
[2026-01-22 03:56:48] [WARNING] 无法获取Glassdoor职位
[2026-01-22 03:56:48] [INFO] 从Glassdoor抓取了 0 个职位
[2026-01-22 03:56:54] [INFO] 正在抓取 Monster 职位...
[2026-01-22 03:56:54] [INFO] 发起请求: https://www.monster.com/jobs/search?q=Chinese+Teacher&saltyp=1&salary=3000&where=&page=1&so=date.desc
[2026-01-22 03:56:55] [WARNING] 请求被阻止 (状态码 403), 正在重试...
[2026-01-22 03:57:07] [INFO] 重试尝试 2, 等待 9.42 秒...
[2026-01-22 03:57:16] [WARNING] 请求被阻止 (状态码 403), 正在重试...
[2026-01-22 03:57:29] [INFO] 重试尝试 3, 等待 12.38 秒...
[2026-01-22 03:57:41] [WARNING] 请求被阻止 (状态码 403), 正在重试...
[2026-01-22 03:57:54] [ERROR] 尝试 3 次后无法检索 https://www.monster.com/jobs/search?q=Chinese+Teacher&saltyp=1&salary=3000&where=&page=1&so=date.desc
[2026-01-22 03:57:54] [WARNING] 无法获取Monster职位
[2026-01-22 03:57:54] [INFO] 从Monster抓取了 0 个职位
[2026-01-22 03:58:02] [INFO] 正在抓取 SimplyHired 职位...
[2026-01-22 03:58:02] [INFO] 发起请求: https://www.simplyhired.com/search?q=chinese+teacher&fdb=7
[2026-01-22 03:58:03] [WARNING] 请求被阻止 (状态码 403), 正在重试...
[2026-01-22 03:58:17] [INFO] 重试尝试 2, 等待 15.88 秒...
[2026-01-22 03:58:33] [WARNING] 请求被阻止 (状态码 403), 正在重试...
[2026-01-22 03:58:44] [INFO] 重试尝试 3, 等待 15.18 秒...
[2026-01-22 03:59:00] [WARNING] 请求被阻止 (状态码 403), 正在重试...
[2026-01-22 03:59:14] [ERROR] 尝试 3 次后无法检索 https://www.simplyhired.com/search?q=chinese+teacher&fdb=7
[2026-01-22 03:59:14] [WARNING] 无法获取SimplyHired职位
[2026-01-22 03:59:14] [INFO] 从SimplyHired抓取了 0 个职位
[2026-01-22 03:59:14] [INFO] 找到真实数据，移除示例数据
[2026-01-22 03:59:14] [INFO] 职位抓取完成 (5/5 爬虫成功)
[2026-01-22 03:59:14] [INFO] 共找到 12 个符合条件的职位
[2026-01-22 03:59:14] [INFO] 保存结果到文件...
[2026-01-22 03:59:14] [INFO] 结果保存到 data/chinese_teacher_jobs_2026-01-22.csv
[2026-01-22 03:59:14] [INFO] 结果保存到 data/chinese_teacher_jobs_2026-01-22.json
[2026-01-22 03:59:14] [INFO] 摘要保存到 data/summary_2026-01-22.md
[2026-01-22 03:59:14] [INFO] 更新README文件...
[2026-01-22 03:59:14] [INFO] README.md已更新
[2026-01-22 03:59:14] [INFO] 职位抓取成功完成
[2026-01-22 03:59:14] [INFO] 找到 12 个符合条件的职位
[2026-01-22 03:59:14] [INFO] - 已保存到: data/chinese_teacher_jobs_2026-01-22.csv
[2026-01-22 03:59:14] [INFO] - 已保存到: data/chinese_teacher_jobs_2026-01-22.json
[2026-01-22 03:59:14] [INFO] - 已保存到: data/summary_2026-01-22.md
[2026-01-22 03:59:14] [INFO] === 中文教师职位爬虫完成 ===
