[2025-11-16 03:22:03] [INFO] === 启动中文教师职位爬虫 ===
[2025-11-16 03:22:03] [INFO] 初始化爬虫...
[2025-11-16 03:22:03] [INFO] 爬虫初始化完成，今天的日期是: 2025-11-16
[2025-11-16 03:22:03] [INFO] 开始抓取职位...
[2025-11-16 03:22:03] [INFO] 创建示例职位数据以确保输出...
[2025-11-16 03:22:03] [INFO] 正在抓取 Indeed 职位...
[2025-11-16 03:22:03] [INFO] 发起请求: https://www.indeed.com/jobs?q=chinese+teacher+$3000&sort=date&fromage=7&start=0
[2025-11-16 03:22:04] [WARNING] 请求被阻止 (状态码 403), 正在重试...
[2025-11-16 03:22:16] [INFO] 重试尝试 2, 等待 12.84 秒...
[2025-11-16 03:22:29] [WARNING] 请求被阻止 (状态码 403), 正在重试...
[2025-11-16 03:22:40] [INFO] 重试尝试 3, 等待 22.72 秒...
[2025-11-16 03:23:03] [WARNING] 请求被阻止 (状态码 403), 正在重试...
[2025-11-16 03:23:16] [ERROR] 尝试 3 次后无法检索 https://www.indeed.com/jobs?q=chinese+teacher+$3000&sort=date&fromage=7&start=0
[2025-11-16 03:23:16] [WARNING] 无法获取Indeed页面 0
[2025-11-16 03:23:16] [INFO] 发起请求: https://www.indeed.com/jobs?q=chinese+teacher+$3000&sort=date&fromage=7&start=10
[2025-11-16 03:23:16] [WARNING] 请求被阻止 (状态码 403), 正在重试...
[2025-11-16 03:23:30] [INFO] 重试尝试 2, 等待 9.82 秒...
[2025-11-16 03:23:40] [WARNING] 请求被阻止 (状态码 403), 正在重试...
[2025-11-16 03:23:53] [INFO] 重试尝试 3, 等待 10.68 秒...
[2025-11-16 03:24:04] [WARNING] 请求被阻止 (状态码 403), 正在重试...
[2025-11-16 03:24:14] [ERROR] 尝试 3 次后无法检索 https://www.indeed.com/jobs?q=chinese+teacher+$3000&sort=date&fromage=7&start=10
[2025-11-16 03:24:14] [WARNING] 无法获取Indeed页面 1
[2025-11-16 03:24:14] [INFO] 发起请求: https://www.indeed.com/jobs?q=chinese+teacher+$3000&sort=date&fromage=7&start=20
[2025-11-16 03:24:14] [WARNING] 请求被阻止 (状态码 403), 正在重试...
[2025-11-16 03:24:24] [INFO] 重试尝试 2, 等待 10.49 秒...
[2025-11-16 03:24:35] [WARNING] 请求被阻止 (状态码 403), 正在重试...
[2025-11-16 03:24:46] [INFO] 重试尝试 3, 等待 13.24 秒...
[2025-11-16 03:25:00] [WARNING] 请求被阻止 (状态码 403), 正在重试...
[2025-11-16 03:25:14] [ERROR] 尝试 3 次后无法检索 https://www.indeed.com/jobs?q=chinese+teacher+$3000&sort=date&fromage=7&start=20
[2025-11-16 03:25:14] [WARNING] 无法获取Indeed页面 2
[2025-11-16 03:25:14] [INFO] 从Indeed抓取了 0 个职位
[2025-11-16 03:25:23] [INFO] 正在抓取 LinkedIn 职位...
[2025-11-16 03:25:23] [INFO] 发起请求: https://www.linkedin.com/jobs/search/?keywords=chinese%20teacher&f_TPR=r604800
[2025-11-16 03:25:24] [INFO] 请求成功: https://www.linkedin.com/jobs/search/?keywords=chinese%20teacher&f_TPR=r604800
[2025-11-16 03:25:24] [INFO] 在LinkedIn上找到 60 个职位卡片
[2025-11-16 03:25:24] [INFO] 找到LinkedIn职位: Chinese- Mandarin Teacher/Instructor for a multilingual Language Cente at Bay Language Academy
[2025-11-16 03:25:24] [INFO] 找到LinkedIn职位: Foreign Language Instructor-Chinese Mandarin at Chi-Chack LLC
[2025-11-16 03:25:24] [INFO] 找到LinkedIn职位: Children Chinese Teacher at Classover
[2025-11-16 03:25:24] [INFO] 找到LinkedIn职位: Adjunct Chinese Foreign Language Instructor at Inside Higher Ed
[2025-11-16 03:25:24] [INFO] 找到LinkedIn职位: High School Foreign Language Mandarin Chinese Teacher - Arcadia High School - Long term Temp (Sub) at Arcadia Unified School District
[2025-11-16 03:25:24] [INFO] 找到LinkedIn职位: Chinese (Foreign Languages) Adjunct Instructor Applicant Pool at Inside Higher Ed
[2025-11-16 03:25:24] [INFO] 找到LinkedIn职位: Mandarin Teacher at Fusion Academy
[2025-11-16 03:25:24] [INFO] 从LinkedIn抓取了 7 个职位
[2025-11-16 03:25:31] [INFO] 正在抓取 Glassdoor 职位...
[2025-11-16 03:25:31] [INFO] 发起请求: https://www.glassdoor.com/Job/chinese-teacher-jobs-SRCH_KO0,15.htm
[2025-11-16 03:25:31] [WARNING] 请求被阻止 (状态码 403), 正在重试...
[2025-11-16 03:25:46] [INFO] 重试尝试 2, 等待 13.24 秒...
[2025-11-16 03:26:00] [WARNING] 请求被阻止 (状态码 403), 正在重试...
[2025-11-16 03:26:14] [INFO] 重试尝试 3, 等待 13.79 秒...
[2025-11-16 03:26:28] [WARNING] 请求被阻止 (状态码 403), 正在重试...
[2025-11-16 03:26:42] [ERROR] 尝试 3 次后无法检索 https://www.glassdoor.com/Job/chinese-teacher-jobs-SRCH_KO0,15.htm
[2025-11-16 03:26:42] [WARNING] 无法获取Glassdoor职位
[2025-11-16 03:26:42] [INFO] 从Glassdoor抓取了 0 个职位
[2025-11-16 03:26:50] [INFO] 正在抓取 Monster 职位...
[2025-11-16 03:26:50] [INFO] 发起请求: https://www.monster.com/jobs/search?q=Chinese+Teacher&saltyp=1&salary=3000&where=&page=1&so=date.desc
[2025-11-16 03:26:50] [INFO] 请求成功: https://www.monster.com/jobs/search?q=Chinese+Teacher&saltyp=1&salary=3000&where=&page=1&so=date.desc
[2025-11-16 03:26:50] [WARNING] 在Monster上找不到职位卡片，尝试替代选择器
[2025-11-16 03:26:50] [WARNING] 在Monster上使用任何选择器都找不到职位卡片
[2025-11-16 03:26:50] [INFO] 从Monster抓取了 0 个职位
[2025-11-16 03:26:59] [INFO] 正在抓取 SimplyHired 职位...
[2025-11-16 03:26:59] [INFO] 发起请求: https://www.simplyhired.com/search?q=chinese+teacher&fdb=7
[2025-11-16 03:26:59] [WARNING] 请求被阻止 (状态码 403), 正在重试...
[2025-11-16 03:27:13] [INFO] 重试尝试 2, 等待 9.38 秒...
[2025-11-16 03:27:23] [WARNING] 请求被阻止 (状态码 403), 正在重试...
[2025-11-16 03:27:34] [INFO] 重试尝试 3, 等待 17.95 秒...
[2025-11-16 03:27:52] [WARNING] 请求被阻止 (状态码 403), 正在重试...
[2025-11-16 03:28:05] [ERROR] 尝试 3 次后无法检索 https://www.simplyhired.com/search?q=chinese+teacher&fdb=7
[2025-11-16 03:28:05] [WARNING] 无法获取SimplyHired职位
[2025-11-16 03:28:05] [INFO] 从SimplyHired抓取了 0 个职位
[2025-11-16 03:28:05] [INFO] 找到真实数据，移除示例数据
[2025-11-16 03:28:05] [INFO] 职位抓取完成 (5/5 爬虫成功)
[2025-11-16 03:28:05] [INFO] 共找到 7 个符合条件的职位
[2025-11-16 03:28:05] [INFO] 保存结果到文件...
[2025-11-16 03:28:05] [INFO] 结果保存到 data/chinese_teacher_jobs_2025-11-16.csv
[2025-11-16 03:28:05] [INFO] 结果保存到 data/chinese_teacher_jobs_2025-11-16.json
[2025-11-16 03:28:05] [INFO] 摘要保存到 data/summary_2025-11-16.md
[2025-11-16 03:28:05] [INFO] 更新README文件...
[2025-11-16 03:28:05] [INFO] README.md已更新
[2025-11-16 03:28:05] [INFO] 职位抓取成功完成
[2025-11-16 03:28:05] [INFO] 找到 7 个符合条件的职位
[2025-11-16 03:28:05] [INFO] - 已保存到: data/chinese_teacher_jobs_2025-11-16.csv
[2025-11-16 03:28:05] [INFO] - 已保存到: data/chinese_teacher_jobs_2025-11-16.json
[2025-11-16 03:28:05] [INFO] - 已保存到: data/summary_2025-11-16.md
[2025-11-16 03:28:05] [INFO] === 中文教师职位爬虫完成 ===
